{
  "schema_version": "0.1.0",
  "object_type": "lifecycle_object",
  "lifecycle_object_id": "urn:lifecycle-object:agent-alpha-child",
  "agent_instance_id": "agent-alpha-child",
  "lineage_id": "lineage-root-001",
  "persona_ref": "urn:pop:persona:research-assistant:v1",
  "current_state": "TERMINATED",
  "state_since": "2026-03-17T03:10:00Z",
  "governance_profile_ref": "urn:governance-profile:token-governor:default:v1",
  "receipt_chain_head": "urn:lifecycle-receipt:terminate-agent-alpha-child",
  "evidence_refs": [
    "urn:evidence:bundle:terminate-agent-alpha-child"
  ],
  "created_at": "2026-03-17T02:00:00Z"
}
